date,description,employer,employer_link,last_updated,location,rating,salary,title,url
 - 6 days ago,"Why Work for OpenTable?
,OpenTable is a global company dedicated to continually solving new problems to help create amazing dining experiences. We enable restaurants around the world to delight their guests with every meal. We are the leaders in restaurant technology, constantly reinventing ourselves and the products we offer so restaurants can thrive and improve their businesses.
,
We're looking for curious, creative engineering interns to help us tackle tough problems. Join us and put powerful products into the hands of thousands while learning the latest in web and native technologies.
,
What you'll be Cooking Up
,
,Menu of technical challenges may include:,
,
,Develop new features for Node.js, AngularJS, iOS, or Android products,
,Componentize UI areas to be plugged into various AngularJS micro sites,
,Developing REST APIs in Java; deploy in Docker,
,Grow shared frameworks for end­ to­ end automation using technologies like PhantomJS, Sauce Labs, and KIF.,
,Improve and dockerize build and test pipelines for continuous delivery,
,Building data science solutions that will directly impact our restaurants,
,
Your Ingredients
,You're a serious software engineer who wants more experience coding on a team. You're curious, like tackling tough problems, and your work is careful and complete. You listen well and actively seek feedback to improve.
,
,
,At least 3 years towards a Bachelor's degree in software engineering,
,Proven success in classwork/lab and/or internships,
,Strong aptitude to learn quickly,
,Ability to solve problems,
,Work well in a fast moving environment,
,
About OpenTable
,Now is an amazing time to be at OpenTable. Our business is expanding into new markets and we're constantly finding new ways to help restaurants and diners. For example, diners can pay their bills without ever asking for a check or contribute photos to a restaurant's online presence. Restaurant managers can update their holiday schedule with two clicks from a beach or from their desk. They only need access to the internet to stay connected to their restaurant from anywhere in the world.
,
Our people are at the core of our company's success. OpenTable's engineering team has loads of experience and imagination, and you'll get to contribute meaningful work side­ by ­side with our talented engineers.
,
We love to have fun, and our teams are diverse with an incredible range of personalities and interests. Most of all, our engineers are dedicated and brilliant. We're leaders in innovation, and passionate about changing the world by pioneering new dining experiences.
,
Perks
,
,
,Beautiful office in downtown San Francisco, right across the street from Montgomery BART station,
,Regular office breakfasts, lunches, happy hours and parties,
,The best part? People you enjoy seeing every day.,
,
Want a seat at our table? If you're smart, creative, and excited about making a difference in the way people dine out, we'd like to meet you.
,
OpenTable is proud to be an Equal Employment Opportunity and Affirmative Action Employer M/F/D/V
,
#IND-RSS",OpenTable,https://www.indeed.com/cmp/Opentable?campaignid=mobvjcmp&from=mobviewjob&tk=1dsgnfvompb9i800&fromjk=f063e70c0b372ce0,,"San Ramon,CA",,Internship,Software Engineering Intern,https://www.indeed.com/viewjob?jk=f063e70c0b372ce0&tk=1dsgnftjip6gm800&from=serp&vjs=3&advn=8263540584173171&adid=280318070&sjdu=VyNrwcfTK15LupteTX0rmUq3ZUi0xZY7cdDukYuT-bw
 - 7 days ago,"Kelly Services is hiring a Software QA Engineer Intern for a short-term contract opportunity in Fremont, California. Below are the details and required skills. For immediate consideration, please email your resume directly to kim.hewlen@kellyservices.com as well as apply online.,
,
,Software QA Engineer Internship,
,Fremont, CA,
,Contract: 1/6/20 – 3/31/20,
,
The Software QA Engineer Intern designs, implements, and tests system software for failure analysis and electrical fault detection equipment. As a member of the Electrical Fault Analysis (EFA) software team, you’ll be responsible for software quality control and assurance including manual and automated testing.,
,
Duties and responsibilities:,
,Find and file defects based on manual and automated testing, track bugs, and work with design/software engineering teams to resolve issues.,
,Automate test cases and manage test suites.,
,Strategize regression, smoke, and alpha tests with QA team and write them into test case management software.,
,Participate in system architecture, design and development for software features in EFA products.,
,
Requirements:,
,Basic knowledge of electrical engineering and semiconductor design concepts: e.g. CMOS process, digital IC’s.,
,Understands software development lifecycle, knowledge of Agile is a plus.,
,Essential understanding of software testing approaches.,
,Strong C# or other OOP languages.,
,Experience writing unit tests.,
,Strong oral, written, and presentation communications skills.,
,Minimum 2 years of education in Computer Engineering, Computer Science, or related engineering program / Currently seeking BS in CE, CS, or EE from an accredited college.,
,
,
,Why Kelly,®,?,
,With Kelly, you’ll have direct connections to leading IT organizations in the best companies around the globe—offering you the chance to work on some of today’s most intriguing, innovative and high-visibility projects. In a field where change is the only constant, our connections and opportunities will help you take your career exactly where you want to go. We work with 90 of the Fortune 100™ companies companies and found opportunities for more than 8,600 IT professionals last year. Let us help advance your career today.,
,About Kelly,®,
,At Kelly, we’re always thinking about what’s next and advising job seekers on new ways of working to reach their full potential. In fact, we’re a leading advocate for temporary/nontraditional workstyles, because we believe they allow flexibility and tremendous growth opportunities that enable a better way to work and live. Connecting great people with great companies is what we do best, and our employment opportunities span a wide variety of workstyles, skill levels, and industries around the world.,
,Kelly is an equal opportunity employer committed to employing a diverse workforce, including, but not limited to, minorities, females, individuals with disabilities, protected veterans, sexual orientation, gender identity. Equal Employment Opportunity is The Law.",Kelly Services,https://www.indeed.com/cmp/Kelly-Services?campaignid=mobvjcmp&from=mobviewjob&tk=1dsgng084pb9i800&fromjk=189c547ba0bdd611,,"San Ramon,CA",,"Temporary, Contract, Internship",Software QA Engineer Intern,https://www.indeed.com/viewjob?jk=189c547ba0bdd611&tk=1dsgnfvstoscj800&from=serp&vjs=3&advn=6111343572945211&adid=289134125&sjdu=9nrDNPdV1DghkDNnC2WJlW1nrk21-asFvjSk9jx-s_OGMnXC8_RNWhee1t3qBzCoeS88Qkg_nQrR-qrah9iVzI17GTaIq_XZuCx7GIOqPydAmAeSdROOZifoi0X7PLnr3-6jO3HUx7fnxoseSqMxdHSuRoZbSPCwsxMPXOQZKAvp85WFZ76u30w0cNtPTlgEc6ggs7IKzgRQDLrvxgaR0o_B8x-CMNOTBto0S-nbEvvTOeb6CnIFrYZL1ryy18eArdCzJ7QJeJYq-woiV_jv_iRt-pVSZ2ApDQ7ezhq4vFo_jpDyxot3t7du8svejvYpZzLPRmCGjyINlJwwUo0VDhneGy--a2InnCzUCNlNsiemFO11u3gGwfyXv-uUtQFQvSfMR7jfE-NzjnkFVl4eeZDwXaepEUKldH5PNzU2FhRDnvOk2BNs9KorBJz4d8gmIURoQ_ICcEHuVVhs3tU4_tGLq5o5cOKh2VxjFm8lEqGJ9MgQjTqNeeMYUBDBWwXD_vJL4Pl2h2f2kmPHwmXkJl2PNsCs4FD1KKAp9kKAMYFHT4B-MFUFR1LcYcdieLlAzVKncfxION9lihQbNr2IDNnRXXQsAg5ZgwilH7my1QVIhxb3lcwaAyRLgnarw0rkNDZv0iXfX1kgLDBUip1yGw
 - 2 days ago,"We are EA —the world’s largest video game publisher. You’re probably familiar with many of our titles—Madden, FIFA, The Sims, Need for Speed, Dead Space, Battlefield and Star Wars, to name a few. But maybe you don’t know how we’re committed to creating games for every platform—from social to mobile to console—to give our consumers that anytime, anywhere access they demand. What does that mean for you? It means more opportunities to unleash your creative genius, be inspired by those around you and ignite your path in any direction you choose.
,
,The Challenge Ahead:,
The EADP Data Group is responsible for developing a new unified Big Data pipeline across all franchises at Electronic Arts. This platform will incorporate data collection, ingestion, processing, access and visualization all built on a modern, cloud based tech stack with best-in-class tools. The Data Group will provide the tools and platform which powers the future state of game development, marketing, sales, accounting and customer experience.
,We are looking for developers who are interested in working on a large scale distributed data system from the ground up for one of the most creative, innovative companies in technology.
,
,Responsibilities:,
Help build a unified data platform across EA, spanning 20+ game studios as data sources
,Develop infrastructure software that slice and dice data, using Hadoop and Map/Reduce
,Develop reporting systems that inform on essential metrics, detect anomalies, and forecast future results
,Develop complex queries to solve data mining problems
,Write reliable and efficient programs scaling to massive (petabyte) datasets and large clusters of machines
,Flexibility to work with both SQL and NoSQL solutions
,Work with data modelers, data analysts, and BI developers to understand requirements, develop ETL processes, validate results, and bring to production
,Coordinate the efficiency, scalability, and stability of data collection, extraction, and storage processes
,Required Skills
,Work on MS with experience in Computer Science or related technical discipline (or equivalent)
,Experience working with large-scale systems and data platforms/warehouses
,A solid foundation in computer science, with competencies in algorithms, data structures, and software design
,Software development experience, writing clean re-useable code, test-driven development, and continuous integration
,Experience with MapReduce, Hadoop, Hive, or other NoSQL stacks a plus
,Fluency with Java, SQL, Perl/Python, or C++
,Fast prototyping skills, familiarity with scripting languages such as bash, perl, awk, python
,Experience working with columnar analytics databases or relational databases is a plus
,Experience with data modeling and BI tools is a plus",Electronic Arts,https://www.indeed.com/cmp/Electronic-Arts?campaignid=mobvjcmp&from=mobviewjob&tk=1dsgnfvsupb9i800&fromjk=6985229cdfa041ad,,"San Ramon,CA",,,Software Engineer Summer Intern - Java,https://www.indeed.com/viewjob?jk=6985229cdfa041ad&from=serp&vjs=3
 - 30+ days ago,"Job Description,
,
,As a Software Engineer, you could work in the following roles:,
Front End Development,
Backend End Development,
Full Stack Development,
API Developer,
Mobile Development,
Data Analyst,
QA,
Specific assignments will depend on upon your skills sets, interest, location and team needs.,
Software Engineer Interns, will be placed in one of the Technology Organization teams. Here is a list and brief descriptions:,
Network Processing:, At its core, Visa is a payments network that connects consumers and merchants with financial institutions. The team is building the long-term architecture on architecture on open platforms and commodity hardware, as well as opening our technology platforms to enable industry collaboration and innovation through co- development.,
,
Issuer Processing:, Debit Processing Services (DPS), our Issuer Processing platform for North America, processes over half of all Visa Debit transactions and is the largest single prepaid processing platform for Visa prepaid transactions in the U.S. The team also partners with third-party companies outside of the U.S. to deliver value-added services through Visa-owned assets.,
,
Merchant + Acquirer Processing:, Merchant and Acquirer Processing (MAP) is focused on executing the Visa Merchant Strategy, building deeper merchant and acquirer relationships and increasing Total Merchant Value by developing solutions that address complex and emerging merchant and acquirer needs.,
,
Digital and Developer Platform: ,Develop, deliver, and manage end-to-end technology products, services, capabilities, and solutions while collaborating with a global community of client, merchant, and partner developers to promote the growth of digital commerce and mobilization of payments in emerging and developed markets,
,
Data Product Development:, Develops and manages end-to-end technology solutions that create value from our enterprise data through internal and client-focused information-based services, business intelligence and insights, and data-driven product innovation.,
,
Data Platform:, We deliver secure, high-quality and easy-to-use Visa core data assets as a service, together with reliable and scalable data platform as a service, that enable Visa internal partners to rapidly and efficiently innovate data-driven business products and services to lead the digital payment industry,
,
Cybersecurity:, Cybersecurity provides enterprise-wide, risk-based security and continuity programs, and continually evolves security and continuity capabilities to meet changing internal and external threat landscapes.,
,
Corporate IT:, Build, operate and maintain the IT systems and infrastructure necessary to enable a highly connected and collaborative workforce that helps power Visa’s business.,
,
Technology Planning and Business Operations:, Provides a structured approach to synchronize, align and unite technology delivery capabilities with business management strategies for improved Technology + Operations organizational performance, execution and risk control.,
,
Operations + Infrastructure:, For Visa to deliver on the vision of the best way to pay and be paid for everyone, everywhere, O&I must provide best-in-class infrastructure services that are secure, scalable, continuously available, and run on software-defined infrastructures.,
,
,Qualifications,
,
,Basic Qualifications,
Must have a High School diploma or equivalent,
Pursuing a Bachelor's Degree in Computer Science, SW Engineering, Computer Engineering, Information Systems, or a related field, graduating December 2020 or later,
Minimum GPA of 3.0 out of 4.0 (or equivalent scale),
Preferred Qualifications,
Proficiency in at least ,one programming language, or technology including, but not limited to:,
Java/J2EE, C/C++, C#, .NET, python, PHP, Ruby on Rails, XML, Javascript, HTML, CSS, Objective-C, OOD, GoLang, Docker,
Familiar with: JSON, REST APIs, MongoDB, AngularJS, ExpressJS, NodeJS, React,
Big Data technologies: Hadoop, Spark, R, NoSQL,
The ability to tackle challenges and address problems head-on,
Strong ability to collaborate,
Highly driven, inventive and results oriented,
Additional Information,
,
,Work Hours ,This position requires the incumbent to be available during core business hours.,
Travel Requirements ,This position requires the incumbent to travel for work 0% of the time.,
Mental/Physical Requirements ,This position will be performed in an office setting. The position will require the incumbent to sit and stand at a desk, communicate in person and by telephone, frequently operate standard office equipment, such as telephones and computers, and reach with hands and arms.,
EEO Statement ,Visa is an EEO Employer. Qualified applicants will receive consideration for employment without regard to race, color, religion, sex, national origin, sexual orientation, gender identity, disability or protected veteran status. Visa will also consider for employment qualified applicants with criminal histories in a manner consistent with EEOC guidelines and applicable local law.",Visa,https://www.indeed.com/cmp/Visa?campaignid=mobvjcmp&from=mobviewjob&tk=1dsgnfvttpb9h800&fromjk=ca7723e1274c98b5,,"San Ramon,CA",,Internship,Intern - Software Engineer (Bachelor's Degree) - Multiple Locations,https://www.indeed.com/viewjob?jk=ca7723e1274c98b5&from=serp&vjs=3
 - 1 day ago,"Join us as we pursue our disruptive new vision to make machine data accessible, usable and valuable to everyone. We are a company filled with people who are passionate about our product and seek to deliver the best experience for our customers. At Splunk, we’re committed to our work, customers, having fun and most importantly to each other’s success. Learn more about Splunk careers and how you can become a part of our journey!,
Role:,
Splunk is looking for highly motivated college students to join our team. As an intern, you will work on a real project (or a few) and have an opportunity to enjoy our dynamic, startup-like environment.,
You will experience Splunking and what defines our culture while honing the skills which separate our development teams from others. Working to support internal and external customer needs, you will collaborate with multi-functional teams, receive mentorship, and gain insight into our values-driven process. Our goal is both to support your growth and development while empowering you for a successful start to your career.,
Responsibilities:,
As a ,Software Engineer Intern, you will be responsible for …,
Building innovative solutions that enables rapid development. You will get to work with a super smart bunch of folks who are doing state of the art development work (native mobile, front-end and back-end, DevOps) in areas of machine learning, data analytics, infrastructure and event correlations across silos to build best-in-class business analytics software. You will be interacting with product management and customers to understand detailed requirements. You will also work with other engineering teams across Splunk to design and build high-performance solutions.,
You will design, develop, code and test software systems, or applications for software improvements and new products,
You'll actively contribute through participation in agile development of project timelines, implementation design specifications, system flow diagrams, documentation, testing, and ongoing support of systems,
Your voice will have an impact through your recommended modifications to processes and procedures, and directly contribute to standard methodologies, architecture, and implementation,
Requirements:,
Possess knowledge of software engineering processes, agile framework, tools (e.g.: programming proficiency in a language, preferably Go, C++, Java, Python, etc), methods, test development, algorithms and data structure.,
Familiarity with object-oriented programming concepts, large-scale software architecture, networking and distributed systems, and - - UNIX/Linux environments,
You have strong knowledge of programming in one of the following programming languages including but not limited to: Go, C++, Java, Python, Javascript),
Familiarity with REST API and microservices is a plus,
Familiarity with CI/CD concepts is a plus,
Familiarity with tools and technologies like Git, Jenkins, Gitlab, AWS, Docker, GCP is a plus,
You enjoy working well with others in a fast-paced environment,
You enjoy working within an agile environment,
Strong communication skills, verbal and written,
You bring enthusiasm for solving interesting problems,
Education:,
Actively pursuing a Bachelor’s, Master’s, or PhD in Computer Science, Software Engineering, Computer Engineering, Electrical Engineering, Mathematics or a related technical field, and a strong record of academic achievement.,
,
What We Offer You:,
,
The opportunity to work with a set of extraordinarily talented and dedicated peers, all the way from engineering and QA to product management and customer support. Splunk flourishes with disruption and diversity.,
A constant stream of new things for you to learn and an opportunity for growth and mentorship. We believe in growing engineers through ownership and leadership opportunities. We also believe mentors help both sides of the equation.,
A stable, collaborative and supportive work environment,
We value diversity at our company. All qualified applicants will receive consideration for employment without regard to race, color, religion, sex, sexual orientation, gender identity, national origin, or any other applicable legally protected characteristics in the location in which the candidate is applying.,
For job positions in San Francisco, CA, and other locations where required, we will consider for employment qualified applicants with arrest and conviction records.",Splunk,https://www.indeed.com/cmp/Splunk?campaignid=mobvjcmp&from=mobviewjob&tk=1dsgnfnlrpb9h800&fromjk=2ac0a05c1f8b07fe,,"San Ramon,CA",,"Temporary, Internship",Software Engineer Intern (Summer 2020),https://www.indeed.com/viewjob?jk=2ac0a05c1f8b07fe&from=serp&vjs=3
 - 30+ days ago,"Job Category
,Intern
,Job Details
,This is your time to shine. Our software engineering interns are considered full time employees by their peers-in fact, you will be expected to contribute right away as a member of our Scrum teams for future releases. As the world leader in enterprise cloud computing, we release 3 new versions every year with close to 100 new features each release. You will write code that reaches millions of subscribers who use our applications everyday, work on our automated testing infrastructure, and craft the tools that provide real-time monitoring of our service. With such quick turnaround, we don’t want our interns to sit on the sidelines and enjoy the view- we want you to change the way our customers connect their business to the world!
,Responsibilities:
,Implement code fixes under the direction of software architects and senior developers
,Develop well-tuned code that may be included as part of our next software release
,Contribute to our suite of automated tests and testing infrastructure
,Required Skills:
,Enrolled in sophomore year or higher at a college/university or any year at a graduate school
,Working towards a BS or MS in Computer Science, Electrical Engineering or related
,Academic or professional/internship experience with Java
,Understanding of object-oriented programming/design
,Working knowledge of HTML and web technologies
,Ability to quickly learn new technologies
,Strong analytical and problem-solving skills
,Be a self-starter and possess strong sense of self-motivation
,Desired Skills:
,Coursework in SQL and relational database concepts
,Strong competency in javascript and associated frameworks
,About Salesforce
,Salesforce, the Customer Success Platform and world's #1 CRM, empowers companies to connect with their customers in a whole new way. The company was founded on three disruptive ideas: a new technology model in cloud computing, a pay-as-you-go business model, and a new integrated corporate philanthropy model. These founding principles have taken our company to great heights, including being named one of Forbes’s “World’s Most Innovative Company” seven years in a row and one of Fortune’s “100 Best Companies to Work For” nine years in a row. We are the fastest growing of the top 10 enterprise software companies, and this level of growth equals incredible opportunities to grow a career at Salesforce. Together, with our whole Ohana (Hawaiian for ""family"") made up of our employees, customers, partners and communities, we are working to improve the state of the world.
,Posting Statement
,Salesforce.com and Salesforce.org are Equal Employment Opportunity and Affirmative Action Employers. Qualified applicants will receive consideration for employment without regard to race, color, religion, sex, sexual orientation, gender perception or identity, national origin, age, marital status, protected veteran status, or disability status. Headhunters and recruitment agencies may not submit resumes/CVs through this Web site or directly to managers. Salesforce.com and Salesforce.org do not accept unsolicited headhunter and agency resumes. Salesforce.com and Salesforce.org will not pay fees to any third-party agency or company that does not have a signed agreement with Salesforce.com or Salesforce.org.
,Pursuant to the San Francisco Fair Chance Ordinance and the Los Angeles Fair Chance Initiative for Hiring, Salesforce will consider for employment qualified applicants with arrest and conviction records.",Salesforce,https://www.indeed.com/cmp/Salesforce?campaignid=mobvjcmp&from=mobviewjob&tk=1dsgng088pb9h800&fromjk=d5649a296cc0b12b,,"San Ramon,CA",,,Summer 2020 Intern - Software Engineer,https://www.indeed.com/viewjob?jk=d5649a296cc0b12b&from=serp&vjs=3
